{
  "$schema": "https://json-schema.org/draft/2020-12/schema",
  "$id": "https://reward-lens.github.io/schemas/run-series.schema.json",
  "title": "Run series",
  "description": "The labelled training run behind act two. Generated by scripts/build_data.py from the public rollout table and the frozen study record. Consumed by components/timeline-scrubber and by scripts/gen-scene-data.mjs. If this file is missing or fails validation, the build fails; there is no fallback and no synthetic data. CORRECTED AT BUILD TIME in three places, each recorded on the field it changed: evidenceId is nullable beside a `source` citation, `perEpisode` was added for the film, and `rolloutsPerStep` was added because a per-step rate over an unknown denominator is not a rate.",
  "type": "object",
  "additionalProperties": false,
  "required": [
    "meta",
    "steps",
    "series",
    "detectors",
    "transition",
    "provenance"
  ],
  "properties": {
    "meta": {
      "type": "object",
      "additionalProperties": false,
      "required": [
        "subject",
        "rolloutCount",
        "stepCount",
        "stepCountDisagreement",
        "rolloutsPerStep"
      ],
      "properties": {
        "subject": {
          "type": "string",
          "description": "The public dataset identifier. A third-party artifact name, explicitly not an internal identifier, and therefore permitted in rendered output."
        },
        "rolloutCount": {
          "type": "integer",
          "minimum": 1
        },
        "stepCount": {
          "type": "integer",
          "minimum": 1,
          "description": "The step count the site states. See DECISIONS.md D-03."
        },
        "stepCountDisagreement": {
          "type": [
            "object",
            "null"
          ],
          "description": "Non-null when internal records disagree. Rendered as a disclosure beneath the setup table, never suppressed.",
          "additionalProperties": false,
          "required": [
            "values",
            "note",
            "evidenceId",
            "source"
          ],
          "properties": {
            "values": {
              "type": "array",
              "items": {
                "type": "integer"
              },
              "minItems": 2
            },
            "note": {
              "type": "string",
              "minLength": 1
            },
            "evidenceId": {
              "type": [
                "string",
                "null"
              ],
              "pattern": "^ev:[0-9a-f]{32}$",
              "description": "Null where the number's provenance is a frozen document rather than a store record; `source` then carries the document and the line. RE-TYPED AT BUILD TIME from a required string: see the description on `source`."
            },
            "source": {
              "type": "array",
              "minItems": 1,
              "items": {
                "type": "object",
                "additionalProperties": false,
                "required": [
                  "document",
                  "line"
                ],
                "description": "Where this number was resolved, when it is not in the evidence store. ADDED AT BUILD TIME, and it is a correction the repository forced. Every other number on this site resolves to a store record and this run's do not: experiments/i5_variance_derivative.py opens with the finding that the campaign evidence store contains NO series that experiment can run on, and PREDICTIONS.md row R3 records that the published rollout table carries no optimiser telemetry, so the gradient-norm comparator cannot be computed at all. The resolution lives in the frozen prediction ledger instead. The alternative was to invent an evidence identifier, which is the exact dishonesty the field exists to prevent.",
                "properties": {
                  "document": {
                    "type": "string",
                    "minLength": 1
                  },
                  "line": {
                    "type": "integer",
                    "minimum": 1
                  }
                }
              }
            }
          }
        },
        "rolloutsPerStep": {
          "type": "integer",
          "minimum": 1,
          "description": "Rollouts recorded at each step. Constant across this run and derived from the table, so a per-step rate is a mean over a known denominator rather than an unknown one."
        }
      }
    },
    "steps": {
      "type": "array",
      "description": "Step indices. Length must equal every array in `series`.",
      "items": {
        "type": "integer",
        "minimum": 0
      },
      "minItems": 2
    },
    "series": {
      "type": "object",
      "description": "One array per plotted quantity, each the same length as `steps`.",
      "additionalProperties": false,
      "required": [
        "hackRate",
        "written",
        "realized"
      ],
      "properties": {
        "hackRate": {
          "$ref": "#/$defs/floatSeries"
        },
        "written": {
          "$ref": "#/$defs/floatSeries"
        },
        "realized": {
          "$ref": "#/$defs/floatSeries"
        },
        "formatOk": {
          "$ref": "#/$defs/floatSeries",
          "description": "The per-step rate of the thinking-format check, which is the half of the trainer's reward predicate that is not the task. It is what separates `written` from `realized` on this run."
        }
      }
    },
    "detectors": {
      "type": "array",
      "description": "Rendered in this order. Not sorted by lead time: sorting by lead puts the worthless detector first with no counterweight.",
      "minItems": 1,
      "items": {
        "type": "object",
        "additionalProperties": false,
        "required": [
          "key",
          "label",
          "alarmStep",
          "leadWidths",
          "surrogateRate",
          "shipped",
          "comparatorLagSteps",
          "evidenceId",
          "source"
        ],
        "properties": {
          "key": {
            "type": "string",
            "pattern": "^[a-z0-9_]+$"
          },
          "label": {
            "type": "string",
            "description": "The public name. Must not contain an internal identifier; checked against data/banned-terms.json."
          },
          "alarmStep": {
            "type": [
              "integer",
              "null"
            ],
            "description": "null when the detector does not alarm on this run."
          },
          "leadWidths": {
            "type": [
              "number",
              "null"
            ],
            "description": "Lead divided by the fitted 10-to-90 transition width. Negative means it lags."
          },
          "surrogateRate": {
            "type": [
              "number",
              "null"
            ],
            "minimum": 0,
            "maximum": 1,
            "description": "Fraction of order-destroyed in-control surrogates on which this detector fires."
          },
          "surrogateRateFromTrainerLog": {
            "type": [
              "number",
              "null"
            ],
            "minimum": 0,
            "maximum": 1
          },
          "shipped": {
            "type": "boolean",
            "description": "Exactly one detector may be true."
          },
          "comparatorLagSteps": {
            "type": [
              "integer",
              "null"
            ],
            "description": "How many steps after the labelled transition midpoint this detector alarms, when the frozen ledger states it. Null on every detector the ledger does not state it for, which is all of them but the registered comparator. ADDED AT BUILD TIME, GROUND-TRUTH.md C-42: the value existed only inside `discardedReason`'s prose, so the page would have rendered it as `alarmStep - transition.midpointStep`, and gate 5 fails a derived number correctly because it resolves to no record. It is parsed from the same ledger row as the rest of the detector, and the generator additionally checks the row agrees with itself.",
            "minimum": 0
          },
          "discardedReason": {
            "type": [
              "string",
              "null"
            ]
          },
          "evidenceId": {
            "type": [
              "string",
              "null"
            ],
            "pattern": "^ev:[0-9a-f]{32}$",
            "description": "Null where the number's provenance is a frozen document rather than a store record; `source` then carries the document and the line. RE-TYPED AT BUILD TIME from a required string: see the description on `source`."
          },
          "source": {
            "type": "object",
            "additionalProperties": false,
            "required": [
              "document",
              "line"
            ],
            "description": "Where this number was resolved, when it is not in the evidence store. ADDED AT BUILD TIME, and it is a correction the repository forced. Every other number on this site resolves to a store record and this run's do not: experiments/i5_variance_derivative.py opens with the finding that the campaign evidence store contains NO series that experiment can run on, and PREDICTIONS.md row R3 records that the published rollout table carries no optimiser telemetry, so the gradient-norm comparator cannot be computed at all. The resolution lives in the frozen prediction ledger instead. The alternative was to invent an evidence identifier, which is the exact dishonesty the field exists to prevent.",
            "properties": {
              "document": {
                "type": "string",
                "minLength": 1
              },
              "line": {
                "type": "integer",
                "minimum": 1
              }
            }
          }
        }
      }
    },
    "transition": {
      "type": "object",
      "additionalProperties": false,
      "required": [
        "midpoint",
        "width1090",
        "r2",
        "evidenceId",
        "source"
      ],
      "properties": {
        "midpoint": {
          "type": "number"
        },
        "width1090": {
          "type": "number",
          "exclusiveMinimum": 0
        },
        "r2": {
          "type": "number",
          "minimum": 0,
          "maximum": 1
        },
        "evidenceId": {
          "type": [
            "string",
            "null"
          ],
          "pattern": "^ev:[0-9a-f]{32}$",
          "description": "Null where the number's provenance is a frozen document rather than a store record; `source` then carries the document and the line. RE-TYPED AT BUILD TIME from a required string: see the description on `source`."
        },
        "source": {
          "type": "object",
          "additionalProperties": false,
          "required": [
            "document",
            "line"
          ],
          "description": "Where this number was resolved, when it is not in the evidence store. ADDED AT BUILD TIME, and it is a correction the repository forced. Every other number on this site resolves to a store record and this run's do not: experiments/i5_variance_derivative.py opens with the finding that the campaign evidence store contains NO series that experiment can run on, and PREDICTIONS.md row R3 records that the published rollout table carries no optimiser telemetry, so the gradient-norm comparator cannot be computed at all. The resolution lives in the frozen prediction ledger instead. The alternative was to invent an evidence identifier, which is the exact dishonesty the field exists to prevent.",
          "properties": {
            "document": {
              "type": "string",
              "minLength": 1
            },
            "line": {
              "type": "integer",
              "minimum": 1
            }
          }
        }
      }
    },
    "companion": {
      "type": [
        "object",
        "null"
      ],
      "description": "The registered prediction on this run that resolved against. Required on the page; null here only if the study is withdrawn.",
      "additionalProperties": false,
      "required": [
        "statement",
        "lagWidths",
        "signRobust",
        "magnitudeRobust",
        "evidenceId",
        "source"
      ],
      "properties": {
        "statement": {
          "type": "string"
        },
        "lagWidths": {
          "type": "number"
        },
        "signRobust": {
          "type": "boolean"
        },
        "magnitudeRobust": {
          "type": "boolean"
        },
        "evidenceId": {
          "type": [
            "string",
            "null"
          ],
          "pattern": "^ev:[0-9a-f]{32}$",
          "description": "Null where the number's provenance is a frozen document rather than a store record; `source` then carries the document and the line. RE-TYPED AT BUILD TIME from a required string: see the description on `source`."
        },
        "source": {
          "type": "object",
          "additionalProperties": false,
          "required": [
            "document",
            "line"
          ],
          "description": "Where this number was resolved, when it is not in the evidence store. ADDED AT BUILD TIME, and it is a correction the repository forced. Every other number on this site resolves to a store record and this run's do not: experiments/i5_variance_derivative.py opens with the finding that the campaign evidence store contains NO series that experiment can run on, and PREDICTIONS.md row R3 records that the published rollout table carries no optimiser telemetry, so the gradient-norm comparator cannot be computed at all. The resolution lives in the frozen prediction ledger instead. The alternative was to invent an evidence identifier, which is the exact dishonesty the field exists to prevent.",
          "properties": {
            "document": {
              "type": "string",
              "minLength": 1
            },
            "line": {
              "type": "integer",
              "minimum": 1
            }
          }
        }
      }
    },
    "frozenAnalysisDefect": {
      "type": [
        "object",
        "null"
      ],
      "description": "The defect this build found in its own frozen analysis. Both numbers are published and they disagree in sign. Never omit the unflattering one.",
      "additionalProperties": false,
      "required": [
        "registeredValue",
        "correctedValue",
        "explanation",
        "declined",
        "source"
      ],
      "properties": {
        "registeredValue": {
          "type": "number"
        },
        "correctedValue": {
          "type": "number"
        },
        "explanation": {
          "type": "string"
        },
        "declined": {
          "const": true,
          "description": "The flattering value was declined. Asserting this in the schema means a build that flips it fails."
        },
        "source": {
          "type": "object",
          "additionalProperties": false,
          "required": [
            "document",
            "line"
          ],
          "description": "Where this number was resolved, when it is not in the evidence store. ADDED AT BUILD TIME, and it is a correction the repository forced. Every other number on this site resolves to a store record and this run's do not: experiments/i5_variance_derivative.py opens with the finding that the campaign evidence store contains NO series that experiment can run on, and PREDICTIONS.md row R3 records that the published rollout table carries no optimiser telemetry, so the gradient-norm comparator cannot be computed at all. The resolution lives in the frozen prediction ledger instead. The alternative was to invent an evidence identifier, which is the exact dishonesty the field exists to prevent.",
          "properties": {
            "document": {
              "type": "string",
              "minLength": 1
            },
            "line": {
              "type": "integer",
              "minimum": 1
            }
          }
        }
      }
    },
    "provenance": {
      "type": "object",
      "additionalProperties": false,
      "required": [
        "generatedBy",
        "sourceCommit",
        "generatedAt",
        "rolloutTable",
        "ledger"
      ],
      "properties": {
        "generatedBy": {
          "const": "scripts/build_data.py"
        },
        "sourceCommit": {
          "type": "string",
          "pattern": "^[0-9a-f]{7,40}$"
        },
        "generatedAt": {
          "type": "string",
          "format": "date-time"
        },
        "rolloutTable": {
          "type": "string",
          "minLength": 1,
          "description": "The public per-rollout table every series here is computed from."
        },
        "ledger": {
          "type": "string",
          "minLength": 1,
          "description": "The frozen prediction ledger the detector rows are resolved in."
        }
      }
    },
    "seriesNote": {
      "type": "string",
      "minLength": 1,
      "description": "Which column of the public rollout table each series is, in words, because two of them are the same column under two names and a reader must not take that for two agreeing measurements."
    },
    "perEpisode": {
      "type": "object",
      "additionalProperties": false,
      "required": [
        "note",
        "meanCompletionCharacters",
        "meanReasoningCharacters",
        "totalCompletionCharacters"
      ],
      "description": "The per-step scalars the film's insert needs. ADDED AT BUILD TIME, per the packet's instruction to extend the schema if the field the film needs is not here. NOTE WHAT IS ABSENT: there is no token count. The public rollout table records completion length in CHARACTERS and publishes no token field, so a token count here would be a number with no measurement behind it.",
      "properties": {
        "note": {
          "type": "string",
          "minLength": 1
        },
        "meanCompletionCharacters": {
          "$ref": "#/$defs/floatSeries"
        },
        "meanReasoningCharacters": {
          "$ref": "#/$defs/floatSeries"
        },
        "totalCompletionCharacters": {
          "type": "integer",
          "minimum": 1
        }
      }
    }
  },
  "$defs": {
    "floatSeries": {
      "type": "array",
      "items": {
        "type": "number"
      },
      "minItems": 2
    }
  }
}
