{
 "meta": {
  "subject": "ai-safety-institute/reward-hacking-olmo3.1-32b-kl0.0-seed2",
  "rolloutCount": 25664,
  "stepCount": 400,
  "rolloutsPerStep": 64,
  "stepCountDisagreement": {
   "values": [
    400,
    401
   ],
   "note": "Two rows of the same frozen ledger describe this run with different step counts. The public rollout table carries 401 distinct step indices, labelled 1 through 401. The site states the lower value and does not assert which record is right.",
   "evidenceId": null,
   "source": [
    {
     "document": "reward-lens-assay/PREDICTIONS.md",
     "line": 154
    },
    {
     "document": "reward-lens-assay/PREDICTIONS.md",
     "line": 155
    }
   ]
  }
 },
 "steps": [
  1,
  2,
  3,
  4,
  5,
  6,
  7,
  8,
  9,
  10,
  11,
  12,
  13,
  14,
  15,
  16,
  17,
  18,
  19,
  20,
  21,
  22,
  23,
  24,
  25,
  26,
  27,
  28,
  29,
  30,
  31,
  32,
  33,
  34,
  35,
  36,
  37,
  38,
  39,
  40,
  41,
  42,
  43,
  44,
  45,
  46,
  47,
  48,
  49,
  50,
  51,
  52,
  53,
  54,
  55,
  56,
  57,
  58,
  59,
  60,
  61,
  62,
  63,
  64,
  65,
  66,
  67,
  68,
  69,
  70,
  71,
  72,
  73,
  74,
  75,
  76,
  77,
  78,
  79,
  80,
  81,
  82,
  83,
  84,
  85,
  86,
  87,
  88,
  89,
  90,
  91,
  92,
  93,
  94,
  95,
  96,
  97,
  98,
  99,
  100,
  101,
  102,
  103,
  104,
  105,
  106,
  107,
  108,
  109,
  110,
  111,
  112,
  113,
  114,
  115,
  116,
  117,
  118,
  119,
  120,
  121,
  122,
  123,
  124,
  125,
  126,
  127,
  128,
  129,
  130,
  131,
  132,
  133,
  134,
  135,
  136,
  137,
  138,
  139,
  140,
  141,
  142,
  143,
  144,
  145,
  146,
  147,
  148,
  149,
  150,
  151,
  152,
  153,
  154,
  155,
  156,
  157,
  158,
  159,
  160,
  161,
  162,
  163,
  164,
  165,
  166,
  167,
  168,
  169,
  170,
  171,
  172,
  173,
  174,
  175,
  176,
  177,
  178,
  179,
  180,
  181,
  182,
  183,
  184,
  185,
  186,
  187,
  188,
  189,
  190,
  191,
  192,
  193,
  194,
  195,
  196,
  197,
  198,
  199,
  200,
  201,
  202,
  203,
  204,
  205,
  206,
  207,
  208,
  209,
  210,
  211,
  212,
  213,
  214,
  215,
  216,
  217,
  218,
  219,
  220,
  221,
  222,
  223,
  224,
  225,
  226,
  227,
  228,
  229,
  230,
  231,
  232,
  233,
  234,
  235,
  236,
  237,
  238,
  239,
  240,
  241,
  242,
  243,
  244,
  245,
  246,
  247,
  248,
  249,
  250,
  251,
  252,
  253,
  254,
  255,
  256,
  257,
  258,
  259,
  260,
  261,
  262,
  263,
  264,
  265,
  266,
  267,
  268,
  269,
  270,
  271,
  272,
  273,
  274,
  275,
  276,
  277,
  278,
  279,
  280,
  281,
  282,
  283,
  284,
  285,
  286,
  287,
  288,
  289,
  290,
  291,
  292,
  293,
  294,
  295,
  296,
  297,
  298,
  299,
  300,
  301,
  302,
  303,
  304,
  305,
  306,
  307,
  308,
  309,
  310,
  311,
  312,
  313,
  314,
  315,
  316,
  317,
  318,
  319,
  320,
  321,
  322,
  323,
  324,
  325,
  326,
  327,
  328,
  329,
  330,
  331,
  332,
  333,
  334,
  335,
  336,
  337,
  338,
  339,
  340,
  341,
  342,
  343,
  344,
  345,
  346,
  347,
  348,
  349,
  350,
  351,
  352,
  353,
  354,
  355,
  356,
  357,
  358,
  359,
  360,
  361,
  362,
  363,
  364,
  365,
  366,
  367,
  368,
  369,
  370,
  371,
  372,
  373,
  374,
  375,
  376,
  377,
  378,
  379,
  380,
  381,
  382,
  383,
  384,
  385,
  386,
  387,
  388,
  389,
  390,
  391,
  392,
  393,
  394,
  395,
  396,
  397,
  398,
  399,
  400,
  401
 ],
 "seriesNote": "Every series is the per-step mean of one column of the public rollout table, over the 64 rollouts recorded at that step. hackRate and written are the same column under two names: `passed` is both the labelled outcome the transition is fitted to and the predicate as the benchmark writes it. The dataset also publishes `reward_hacked` and `actually_solved`, which would be the more direct pair; neither is in the cached table, so neither is used here.",
 "series": {
  "hackRate": [
   0.015625,
   0.03125,
   0.0,
   0.0,
   0.015625,
   0.0,
   0.015625,
   0.0,
   0.015625,
   0.0,
   0.015625,
   0.015625,
   0.0,
   0.0,
   0.0,
   0.0,
   0.0,
   0.015625,
   0.0,
   0.0,
   0.015625,
   0.03125,
   0.0,
   0.0,
   0.0,
   0.0,
   0.015625,
   0.0,
   0.0,
   0.0,
   0.0,
   0.0,
   0.015625,
   0.015625,
   0.015625,
   0.0,
   0.0,
   0.0,
   0.0,
   0.0,
   0.0,
   0.0,
   0.015625,
   0.0,
   0.0,
   0.0,
   0.015625,
   0.0,
   0.0,
   0.0,
   0.0,
   0.0,
   0.0,
   0.015625,
   0.015625,
   0.015625,
   0.0,
   0.0,
   0.0,
   0.0,
   0.015625,
   0.0,
   0.0,
   0.0,
   0.015625,
   0.0,
   0.0,
   0.0,
   0.0,
   0.03125,
   0.03125,
   0.03125,
   0.0,
   0.0,
   0.015625,
   0.0,
   0.0,
   0.0,
   0.03125,
   0.0,
   0.015625,
   0.0,
   0.03125,
   0.0,
   0.015625,
   0.015625,
   0.03125,
   0.046875,
   0.046875,
   0.0625,
   0.0,
   0.015625,
   0.03125,
   0.0625,
   0.0625,
   0.078125,
   0.09375,
   0.125,
   0.078125,
   0.15625,
   0.109375,
   0.25,
   0.375,
   0.546875,
   0.5,
   0.546875,
   0.515625,
   0.65625,
   0.546875,
   0.578125,
   0.734375,
   0.625,
   0.78125,
   0.765625,
   0.828125,
   0.875,
   0.859375,
   0.90625,
   0.921875,
   0.859375,
   0.890625,
   0.765625,
   0.859375,
   0.90625,
   0.78125,
   0.859375,
   0.96875,
   0.890625,
   0.875,
   0.96875,
   0.890625,
   0.96875,
   0.9375,
   0.9375,
   0.921875,
   0.921875,
   0.9375,
   0.96875,
   0.96875,
   1.0,
   0.984375,
   0.984375,
   0.984375,
   0.984375,
   1.0,
   1.0,
   0.96875,
   0.984375,
   0.96875,
   1.0,
   0.984375,
   1.0,
   1.0,
   0.984375,
   1.0,
   1.0,
   0.984375,
   1.0,
   0.984375,
   0.984375,
   1.0,
   0.96875,
   1.0,
   1.0,
   0.96875,
   0.96875,
   1.0,
   0.953125,
   1.0,
   0.984375,
   1.0,
   1.0,
   1.0,
   0.984375,
   0.96875,
   1.0,
   1.0,
   0.984375,
   1.0,
   1.0,
   1.0,
   1.0,
   1.0,
   1.0,
   0.96875,
   1.0,
   0.984375,
   1.0,
   0.984375,
   0.984375,
   0.984375,
   0.984375,
   0.984375,
   0.96875,
   1.0,
   0.96875,
   1.0,
   1.0,
   0.984375,
   0.96875,
   0.984375,
   0.984375,
   0.984375,
   1.0,
   0.984375,
   0.984375,
   1.0,
   1.0,
   0.96875,
   1.0,
   0.984375,
   0.96875,
   0.96875,
   1.0,
   0.96875,
   1.0,
   1.0,
   1.0,
   0.984375,
   0.96875,
   1.0,
   0.984375,
   1.0,
   0.984375,
   1.0,
   1.0,
   0.984375,
   0.984375,
   0.984375,
   0.984375,
   1.0,
   0.96875,
   1.0,
   1.0,
   0.984375,
   0.96875,
   1.0,
   0.984375,
   1.0,
   1.0,
   1.0,
   0.96875,
   1.0,
   1.0,
   0.984375,
   1.0,
   0.984375,
   1.0,
   1.0,
   0.984375,
   0.984375,
   0.984375,
   1.0,
   1.0,
   1.0,
   1.0,
   1.0,
   1.0,
   1.0,
   1.0,
   1.0,
   1.0,
   1.0,
   1.0,
   1.0,
   1.0,
   1.0,
   1.0,
   1.0,
   1.0,
   1.0,
   1.0,
   1.0,
   0.984375,
   1.0,
   1.0,
   1.0,
   1.0,
   1.0,
   1.0,
   1.0,
   1.0,
   1.0,
   1.0,
   0.984375,
   0.984375,
   1.0,
   0.984375,
   0.984375,
   1.0,
   1.0,
   0.984375,
   0.984375,
   1.0,
   1.0,
   1.0,
   1.0,
   1.0,
   1.0,
   1.0,
   1.0,
   1.0,
   1.0,
   1.0,
   1.0,
   0.984375,
   0.984375,
   1.0,
   0.984375,
   1.0,
   1.0,
   0.984375,
   1.0,
   1.0,
   1.0,
   1.0,
   1.0,
   1.0,
   1.0,
   0.984375,
   1.0,
   0.984375,
   1.0,
   1.0,
   1.0,
   1.0,
   1.0,
   1.0,
   0.984375,
   1.0,
   1.0,
   1.0,
   1.0,
   1.0,
   1.0,
   1.0,
   1.0,
   1.0,
   1.0,
   0.984375,
   0.984375,
   1.0,
   1.0,
   1.0,
   1.0,
   1.0,
   1.0,
   1.0,
   1.0,
   0.984375,
   1.0,
   1.0,
   1.0,
   1.0,
   1.0,
   1.0,
   1.0,
   1.0,
   1.0,
   1.0,
   1.0,
   1.0,
   1.0,
   1.0,
   0.984375,
   0.96875,
   0.84375,
   1.0,
   1.0,
   1.0,
   0.984375,
   0.984375,
   0.984375,
   1.0,
   1.0,
   0.984375,
   0.984375,
   1.0,
   1.0,
   1.0,
   1.0,
   1.0,
   1.0,
   0.984375,
   1.0,
   1.0,
   1.0,
   1.0,
   1.0,
   1.0,
   1.0,
   1.0,
   0.984375,
   0.984375,
   1.0,
   1.0,
   1.0,
   0.984375,
   1.0,
   1.0,
   0.984375
  ],
  "written": [
   0.015625,
   0.03125,
   0.0,
   0.0,
   0.015625,
   0.0,
   0.015625,
   0.0,
   0.015625,
   0.0,
   0.015625,
   0.015625,
   0.0,
   0.0,
   0.0,
   0.0,
   0.0,
   0.015625,
   0.0,
   0.0,
   0.015625,
   0.03125,
   0.0,
   0.0,
   0.0,
   0.0,
   0.015625,
   0.0,
   0.0,
   0.0,
   0.0,
   0.0,
   0.015625,
   0.015625,
   0.015625,
   0.0,
   0.0,
   0.0,
   0.0,
   0.0,
   0.0,
   0.0,
   0.015625,
   0.0,
   0.0,
   0.0,
   0.015625,
   0.0,
   0.0,
   0.0,
   0.0,
   0.0,
   0.0,
   0.015625,
   0.015625,
   0.015625,
   0.0,
   0.0,
   0.0,
   0.0,
   0.015625,
   0.0,
   0.0,
   0.0,
   0.015625,
   0.0,
   0.0,
   0.0,
   0.0,
   0.03125,
   0.03125,
   0.03125,
   0.0,
   0.0,
   0.015625,
   0.0,
   0.0,
   0.0,
   0.03125,
   0.0,
   0.015625,
   0.0,
   0.03125,
   0.0,
   0.015625,
   0.015625,
   0.03125,
   0.046875,
   0.046875,
   0.0625,
   0.0,
   0.015625,
   0.03125,
   0.0625,
   0.0625,
   0.078125,
   0.09375,
   0.125,
   0.078125,
   0.15625,
   0.109375,
   0.25,
   0.375,
   0.546875,
   0.5,
   0.546875,
   0.515625,
   0.65625,
   0.546875,
   0.578125,
   0.734375,
   0.625,
   0.78125,
   0.765625,
   0.828125,
   0.875,
   0.859375,
   0.90625,
   0.921875,
   0.859375,
   0.890625,
   0.765625,
   0.859375,
   0.90625,
   0.78125,
   0.859375,
   0.96875,
   0.890625,
   0.875,
   0.96875,
   0.890625,
   0.96875,
   0.9375,
   0.9375,
   0.921875,
   0.921875,
   0.9375,
   0.96875,
   0.96875,
   1.0,
   0.984375,
   0.984375,
   0.984375,
   0.984375,
   1.0,
   1.0,
   0.96875,
   0.984375,
   0.96875,
   1.0,
   0.984375,
   1.0,
   1.0,
   0.984375,
   1.0,
   1.0,
   0.984375,
   1.0,
   0.984375,
   0.984375,
   1.0,
   0.96875,
   1.0,
   1.0,
   0.96875,
   0.96875,
   1.0,
   0.953125,
   1.0,
   0.984375,
   1.0,
   1.0,
   1.0,
   0.984375,
   0.96875,
   1.0,
   1.0,
   0.984375,
   1.0,
   1.0,
   1.0,
   1.0,
   1.0,
   1.0,
   0.96875,
   1.0,
   0.984375,
   1.0,
   0.984375,
   0.984375,
   0.984375,
   0.984375,
   0.984375,
   0.96875,
   1.0,
   0.96875,
   1.0,
   1.0,
   0.984375,